id,tipo,titulo,descricao,autor,data,origem,rito,grau,ordem,tags,url,youtube_id,thumbnail,transcricao_status,acesso,perguntas_aprofundamento,publicado_por,publicado_em,anexos
video-u074,video,A Maçonaria Simbólica é incompleta?,Sessão de estudos do Grupo de Estudos Urânia.,Oduwaldo Álvaro,,Grupo de Estudos Urânia,,,,simbolismo; instrumentos,https://www.youtube.com/watch?v=ESctJa46wqk,ESctJa46wqk,https://img.youtube.com/vi/ESctJa46wqk/hqdefault.jpg,pendente,publico,,Rogério,,
video-u075,video,Amor e Afins,Sessão de estudos do Grupo de Estudos Urânia.,Márcio Silva,,Grupo de Estudos Urânia,,,,estudo maçônico,https://www.youtube.com/watch?v=pwcoe7HtuBw,pwcoe7HtuBw,https://img.youtube.com/vi/pwcoe7HtuBw/hqdefault.jpg,pendente,publico,,Rogério,,
video-u076,video,A Inteligência Artificial na Maçonaria,Sessão de estudos do Grupo de Estudos Urânia.,Marcelo Corsini,2023-10-14,Grupo de Estudos Urânia,,,,instrumentos,https://www.youtube.com/watch?v=XPGHGI9f6hg,XPGHGI9f6hg,https://img.youtube.com/vi/XPGHGI9f6hg/hqdefault.jpg,pendente,publico,,Rogério,,
video-u077,video,De Abraão ao Cativeiro da Babilônia,Sessão de estudos do Grupo de Estudos Urânia.,Gilson Mendonça,2023-10-21,Grupo de Estudos Urânia,,,,estudo maçônico,https://www.youtube.com/watch?v=fut15ZjQKDk,fut15ZjQKDk,https://img.youtube.com/vi/fut15ZjQKDk/hqdefault.jpg,pendente,publico,,Rogério,,
video-u078,video,O Propósito Existencial do Maçom - José Bandeira,Sessão de estudos do Grupo de Estudos Urânia.,,,Grupo de Estudos Urânia,,,,instrumentos,https://www.youtube.com/watch?v=UqGPlrh64p4,UqGPlrh64p4,https://img.youtube.com/vi/UqGPlrh64p4/hqdefault.jpg,pendente,publico,,Rogério,,
video-u079,video,A Moral dos Fortes e dos Fracos,Sessão de estudos do Grupo de Estudos Urânia.,Márcio Silva,2023-12-16,Grupo de Estudos Urânia,,,,ética,https://www.youtube.com/watch?v=DRlRl9ux20w,DRlRl9ux20w,https://img.youtube.com/vi/DRlRl9ux20w/hqdefault.jpg,pendente,publico,,Rogério,,
video-u080,video,Combate ao Obscurantismo,Sessão de estudos do Grupo de Estudos Urânia.,Fuad Haddad,,Grupo de Estudos Urânia,,,,estudo maçônico,https://www.youtube.com/watch?v=sDeQbpR0ul8,sDeQbpR0ul8,https://img.youtube.com/vi/sDeQbpR0ul8/hqdefault.jpg,pendente,publico,,Rogério,,
video-u081,video,Os Aventais,Sessão de estudos do Grupo de Estudos Urânia.,José Maldonado,,Grupo de Estudos Urânia,,,,estudo maçônico,https://www.youtube.com/watch?v=HbuiJDJUVlA,HbuiJDJUVlA,https://img.youtube.com/vi/HbuiJDJUVlA/hqdefault.jpg,pendente,publico,,Rogério,,
prancha-u002,prancha,A Simbologia da Morte na Maçonaria,Prancha de estudos do Grupo de Estudos Urânia.,,,Grupo de Estudos Urânia,,,,simbolismo; morte,,,,nao_aplicavel,publico,,Rogério,,https://drive.google.com/file/d/1UufuHlXPHXwbojX8LSoyEHb8mJDifWqc/view
prancha-u005,prancha,Reconhecimento e Regularidade,Prancha do Grupo de Estudos Urânia. Sessão não gravada a pedido dos presentes.,,,Grupo de Estudos Urânia,,,,reconhecimento; regularidade,,,,nao_aplicavel,publico,,Rogério,,https://drive.google.com/file/d/1LsKse2D7TGWYYkcT6_FEXsauY6prb9vP/view
